{
    "slug": "kale",
    "name_en": "Kale",
    "name_sw": "Sukuma wiki",
    "category": "leafy_green",
    "harvest_type": "multi",
    "jica_manual_ref": "Inspired by JICA SHEP PLUS — Kale (Sukuma wiki) production guide",
    "kalro_guide_ref": "KALRO Vegetable production handbook — Kale",
    "ecological_requirements": {
        "altitude_min_m": 800,
        "altitude_max_m": 2400,
        "rainfall_min_mm": 500,
        "rainfall_max_mm": 1500,
        "temperature_min_c": 12,
        "temperature_max_c": 25,
        "soil_types": ["loam", "sandy_loam", "clay_loam"],
        "soil_ph_min": 5.5,
        "soil_ph_max": 6.8
    },
    "varieties": [
        {
            "name": "Collard Mfalme",
            "type": "OPEN_POLLINATED",
            "days_to_maturity": 55,
            "yield_kg_per_acre": 12000,
            "disease_resistance": ["downy_mildew"],
            "supplier_notes": "Most-planted Kenyan kale variety; bred for repeated pluck-harvest."
        },
        {
            "name": "Thousand Headed",
            "type": "OPEN_POLLINATED",
            "days_to_maturity": 60,
            "yield_kg_per_acre": 10000,
            "supplier_notes": "Tall stem, slow bolting; good for upland Rift Valley."
        }
    ],
    "timeline_template": [
        {"activity_type": "nursery_seeding", "phase": "nursery", "week_from_planting": -4, "day_window": 3, "description_en": "Sow seed in seedbed at 1cm depth. Water lightly twice daily.", "description_sw": "Panda mbegu kitaluni kina 1cm. Mwagilia maji kidogo mara mbili kwa siku.", "is_critical": true},
        {"activity_type": "transplanting", "phase": "transplanting", "week_from_planting": 0, "day_window": 2, "description_en": "Transplant 4-week-old seedlings at 60cm x 45cm. Water immediately.", "description_sw": "Pandikiza miche wiki 4 nafasi ya 60cm x 45cm. Mwagilia mara moja.", "is_critical": true},
        {"activity_type": "basal_fertiliser", "phase": "transplanting", "week_from_planting": 0, "day_window": 1, "description_en": "Apply 50kg DAP at transplanting (one tablespoon per hole).", "description_sw": "Weka kilo 50 za DAP wakati wa kupandikiza (kijiko kwa shimo).", "is_critical": true},
        {"activity_type": "first_weeding", "phase": "growth", "week_from_planting": 3, "day_window": 4, "description_en": "Shallow-hoe between rows; mulch with dry grass.", "description_sw": "Palia kwa jembe la juu juu; weka nyasi kavu.", "is_critical": false},
        {"activity_type": "top_dress_1", "phase": "growth", "week_from_planting": 4, "day_window": 3, "description_en": "Apply 50kg CAN as side-dress 10cm from plant base.", "description_sw": "Weka kilo 50 za CAN 10cm kutoka mmea.", "is_critical": true},
        {"activity_type": "pest_monitoring", "phase": "growth", "week_from_planting": 5, "day_window": 14, "description_en": "Scout for diamondback moth and aphids. Spray only if pest threshold exceeded.", "description_sw": "Tafuta wadudu (diamondback na kunguru). Nyunyuza dawa ikiwa wamezidi.", "tip_en": "Hand-pick caterpillars at low density to avoid spray costs.", "tip_sw": "Chukua viwavi kwa mkono ikiwa wachache, ili kuepuka gharama ya dawa.", "is_critical": false},
        {"activity_type": "first_harvest", "phase": "harvest", "week_from_planting": 8, "day_window": 7, "description_en": "Pluck 2-3 outer leaves per plant. Leave the crown intact for regrowth.", "description_sw": "Chuna majani 2-3 ya nje kwa kila mmea. Acha kichwa cha mmea.", "tip_en": "Harvest every 7-10 days. A well-tended crop yields 6+ months.", "tip_sw": "Vuna kila siku 7-10. Mmea ulio na uangalifu mzuri unaweza kuvuna miezi 6+.", "is_critical": true},
        {"activity_type": "top_dress_2", "phase": "growth", "week_from_planting": 10, "day_window": 3, "description_en": "Second 50kg CAN dose to sustain leaf production.", "description_sw": "Dosi ya pili ya CAN kilo 50 kuendeleza majani.", "is_critical": false}
    ],
    "inputs_per_acre": [
        {"input_type": "seed", "product_name": "Collard Mfalme (250g)", "quantity": 250, "unit": "g", "week_from_planting": -4, "benchmark_price_kes": 800, "pcpb_registered": false, "alternatives": ["Thousand Headed", "Marrowstem"]},
        {"input_type": "fertiliser", "product_name": "DAP 50kg", "quantity": 50, "unit": "kg", "week_from_planting": 0, "benchmark_price_kes": 3500, "pcpb_registered": false},
        {"input_type": "fertiliser", "product_name": "CAN 50kg (top-dress 1)", "quantity": 50, "unit": "kg", "week_from_planting": 4, "benchmark_price_kes": 2800, "pcpb_registered": false},
        {"input_type": "fertiliser", "product_name": "CAN 50kg (top-dress 2)", "quantity": 50, "unit": "kg", "week_from_planting": 10, "benchmark_price_kes": 2800, "pcpb_registered": false},
        {"input_type": "chemical", "product_name": "Karate 5EC (500ml)", "quantity": 500, "unit": "ml", "week_from_planting": 6, "benchmark_price_kes": 850, "pcpb_registered": true, "alternatives": ["Decis 2.5EC"]},
        {"input_type": "other", "product_name": "Twine bundles (harvest)", "quantity": 10, "unit": "pieces", "week_from_planting": 8, "benchmark_price_kes": 300, "pcpb_registered": false}
    ],
    "yield_per_acre": {"expected_kg": 12000, "min_kg": 9000, "max_kg": 15000, "number_of_picks": 20, "pick_interval_days": 7},
    "post_harvest": {"shelf_life_days": 3, "grading_criteria": "Bunch by stem length. Reject yellowed or holed leaves.", "packaging_standard": "Tied bunches of 8-10 leaves; loaded loose in pickup beds.", "storage_tips_en": "Sell same-day; refrigerate at 4°C only if overnight delay.", "storage_tips_sw": "Uza siku hiyohiyo; hifadhi friji 4°C ikiwa lazima kuchelewa usiku."},
    "diseases": ["diamondback_moth", "aphids", "black_rot", "downy_mildew"]
}
