{
    "slug": "eggplant",
    "name_en": "Eggplant",
    "name_sw": "Biringanya",
    "category": "vegetable",
    "harvest_type": "multi",
    "jica_manual_ref": "Inspired by JICA SHEP PLUS — Eggplant manual",
    "kalro_guide_ref": "KALRO Eggplant production guide",
    "ecological_requirements": {
        "altitude_min_m": 500,
        "altitude_max_m": 1800,
        "rainfall_min_mm": 600,
        "rainfall_max_mm": 1200,
        "temperature_min_c": 20,
        "temperature_max_c": 32,
        "soil_types": ["sandy_loam", "loam"],
        "soil_ph_min": 5.5,
        "soil_ph_max": 6.8
    },
    "varieties": [
        {"name": "Black Beauty", "type": "OPEN_POLLINATED", "days_to_maturity": 80, "yield_kg_per_acre": 14000, "supplier_notes": "Standard purple oval; main fresh-market variety."},
        {"name": "Long Purple", "type": "OPEN_POLLINATED", "days_to_maturity": 85, "yield_kg_per_acre": 12000, "supplier_notes": "Elongated fruit; popular in Indian-Kenyan cuisine markets."}
    ],
    "timeline_template": [
        {"activity_type": "nursery_seeding", "phase": "nursery", "week_from_planting": -5, "day_window": 3, "description_en": "Sow seed in nursery trays at 0.5cm depth.", "description_sw": "Panda mbegu trei kina 0.5cm.", "is_critical": true},
        {"activity_type": "transplanting", "phase": "transplanting", "week_from_planting": 0, "day_window": 2, "description_en": "Transplant 5-week seedlings at 75cm x 60cm (large plants).", "description_sw": "Pandikiza miche wiki 5 nafasi 75cm x 60cm.", "is_critical": true},
        {"activity_type": "basal_fertiliser", "phase": "transplanting", "week_from_planting": 0, "day_window": 1, "description_en": "Apply 50kg DAP at planting.", "description_sw": "Weka kilo 50 za DAP.", "is_critical": true},
        {"activity_type": "first_weeding", "phase": "growth", "week_from_planting": 3, "day_window": 4, "description_en": "Hand-weed and mulch heavily.", "description_sw": "Palia na funika vizuri.", "is_critical": false},
        {"activity_type": "top_dress_1", "phase": "growth", "week_from_planting": 4, "day_window": 3, "description_en": "Apply 50kg CAN side-dressed.", "description_sw": "Weka kilo 50 za CAN.", "is_critical": true},
        {"activity_type": "pest_spray", "phase": "growth", "week_from_planting": 6, "day_window": 7, "description_en": "Spray for shoot/fruit borer — the main eggplant pest.", "description_sw": "Nyunyuza dawa ya shoot/fruit borer.", "is_critical": true},
        {"activity_type": "top_dress_2", "phase": "growth", "week_from_planting": 8, "day_window": 3, "description_en": "Second 50kg CAN.", "description_sw": "CAN ya pili.", "is_critical": true},
        {"activity_type": "first_harvest", "phase": "harvest", "week_from_planting": 11, "day_window": 7, "description_en": "Pick fruits at 12-15cm, glossy and firm. Cut with shears.", "description_sw": "Vuna matunda urefu 12-15cm, yenye kung'aa.", "tip_en": "Pick every 5-7 days. Overripe fruits become bitter.", "tip_sw": "Vuna kila siku 5-7. Yakizidi yataungua.", "is_critical": true}
    ],
    "inputs_per_acre": [
        {"input_type": "seed", "product_name": "Black Beauty (150g)", "quantity": 150, "unit": "g", "week_from_planting": -5, "benchmark_price_kes": 2500, "pcpb_registered": false, "alternatives": ["Long Purple", "Florida Market"]},
        {"input_type": "fertiliser", "product_name": "DAP 50kg", "quantity": 50, "unit": "kg", "week_from_planting": 0, "benchmark_price_kes": 3500, "pcpb_registered": false},
        {"input_type": "fertiliser", "product_name": "CAN 50kg (top-dress 1)", "quantity": 50, "unit": "kg", "week_from_planting": 4, "benchmark_price_kes": 2800, "pcpb_registered": false},
        {"input_type": "fertiliser", "product_name": "CAN 50kg (top-dress 2)", "quantity": 50, "unit": "kg", "week_from_planting": 8, "benchmark_price_kes": 2800, "pcpb_registered": false},
        {"input_type": "chemical", "product_name": "Match 50EC (500ml)", "quantity": 500, "unit": "ml", "week_from_planting": 6, "benchmark_price_kes": 1400, "pcpb_registered": true},
        {"input_type": "chemical", "product_name": "Karate 5EC (500ml)", "quantity": 500, "unit": "ml", "week_from_planting": 7, "benchmark_price_kes": 850, "pcpb_registered": true},
        {"input_type": "other", "product_name": "Crates 20kg (harvest)", "quantity": 35, "unit": "crates", "week_from_planting": 11, "benchmark_price_kes": 10500, "pcpb_registered": false}
    ],
    "yield_per_acre": {"expected_kg": 14000, "min_kg": 10000, "max_kg": 18000, "number_of_picks": 10, "pick_interval_days": 6},
    "post_harvest": {"shelf_life_days": 7, "grading_criteria": "Grade A: glossy, firm, no blemishes. Grade B: minor scuff or shape variation.", "packaging_standard": "20kg crates with newspaper liner.", "storage_tips_en": "10-12°C cool storage. Don't refrigerate — chilling injury below 10°C.", "storage_tips_sw": "10-12°C. Epuka friji — huharibika chini ya 10°C."},
    "diseases": ["shoot_borer", "fruit_borer", "bacterial_wilt", "verticillium_wilt"]
}
