{
    "slug": "cowpea-leaves",
    "name_en": "Cowpea leaves",
    "name_sw": "Kunde",
    "category": "leafy_green",
    "harvest_type": "multi",
    "jica_manual_ref": "Inspired by JICA SHEP PLUS — Cowpea leaves (dual-purpose) manual",
    "kalro_guide_ref": "KALRO Cowpea production guide — leaf+grain dual purpose",
    "ecological_requirements": {
        "altitude_min_m": 0,
        "altitude_max_m": 1800,
        "rainfall_min_mm": 400,
        "rainfall_max_mm": 1200,
        "temperature_min_c": 18,
        "temperature_max_c": 32,
        "soil_types": ["sandy_loam", "loam", "sandy"],
        "soil_ph_min": 5.5,
        "soil_ph_max": 7.0
    },
    "varieties": [
        {"name": "M66", "type": "OPEN_POLLINATED", "days_to_maturity": 35, "yield_kg_per_acre": 5000, "supplier_notes": "KALRO-released; high leaf yield; mid-altitude."},
        {"name": "Katumani 80", "type": "OPEN_POLLINATED", "days_to_maturity": 40, "yield_kg_per_acre": 4500, "supplier_notes": "Drought-tolerant; ASAL-zone preferred."}
    ],
    "timeline_template": [
        {"activity_type": "land_prep", "phase": "land_prep", "week_from_planting": -1, "day_window": 4, "description_en": "Plough to fine tilth. Cowpea fixes nitrogen — modest base fertiliser only.", "description_sw": "Lima vizuri. Kunde huleta nitrojeni — mbolea kidogo tu.", "is_critical": false},
        {"activity_type": "seed_planting", "phase": "transplanting", "week_from_planting": 0, "day_window": 2, "description_en": "Direct-sow at 3cm depth, 30cm x 15cm spacing.", "description_sw": "Panda moja kwa moja kina 3cm nafasi 30cm x 15cm.", "is_critical": true},
        {"activity_type": "basal_fertiliser", "phase": "transplanting", "week_from_planting": 0, "day_window": 1, "description_en": "Apply 25kg DAP at planting. Light dose — beans are nitrogen-fixers.", "description_sw": "Weka kilo 25 za DAP. Maharagwe huleta nitrojeni.", "is_critical": false},
        {"activity_type": "first_weeding", "phase": "growth", "week_from_planting": 2, "day_window": 4, "description_en": "Shallow weeding. Avoid root disturbance.", "description_sw": "Palia juu juu. Epuka kusumbua mizizi.", "is_critical": false},
        {"activity_type": "pest_check", "phase": "growth", "week_from_planting": 3, "day_window": 7, "description_en": "Scout for aphids; spray only if heavy infestation.", "description_sw": "Tafuta vidudu; nyunyuza tu wakizidi.", "is_critical": false},
        {"activity_type": "first_harvest", "phase": "harvest", "week_from_planting": 5, "day_window": 4, "description_en": "Pluck top tender leaves and shoots. Leave growing points intact.", "description_sw": "Chuna majani na shina laini ya juu. Acha kichwa cha mmea.", "tip_en": "Plucking encourages bushier regrowth.", "tip_sw": "Kuchuna huongeza ukuaji wa matawi.", "is_critical": true},
        {"activity_type": "subsequent_harvests", "phase": "harvest", "week_from_planting": 6, "day_window": 21, "description_en": "Continue plucking every 7 days for 6 weeks. Grain harvest later if desired.", "description_sw": "Endelea kuchuna kila siku 7 wiki 6.", "is_critical": false}
    ],
    "inputs_per_acre": [
        {"input_type": "seed", "product_name": "M66 cowpea (10kg)", "quantity": 10, "unit": "kg", "week_from_planting": 0, "benchmark_price_kes": 1500, "pcpb_registered": false, "alternatives": ["Katumani 80", "K80"]},
        {"input_type": "fertiliser", "product_name": "DAP 25kg", "quantity": 25, "unit": "kg", "week_from_planting": 0, "benchmark_price_kes": 1800, "pcpb_registered": false},
        {"input_type": "chemical", "product_name": "Karate 5EC (250ml)", "quantity": 250, "unit": "ml", "week_from_planting": 3, "benchmark_price_kes": 450, "pcpb_registered": true, "alternatives": ["Match 50EC"]}
    ],
    "yield_per_acre": {"expected_kg": 5000, "min_kg": 3000, "max_kg": 7000, "number_of_picks": 7, "pick_interval_days": 7},
    "post_harvest": {"shelf_life_days": 2, "grading_criteria": "Tender leaves + shoots only. Reject tough or yellowed.", "packaging_standard": "Bunches 250g for same-day market.", "storage_tips_en": "Sell same-day. Sprinkle with water under shade.", "storage_tips_sw": "Uza siku hiyohiyo. Nyunyizia maji."},
    "diseases": ["aphids", "thrips", "powdery_mildew", "bacterial_blight"]
}
